{
  "answer": "The provided context does not contain any arguments or discussions specifically about walkability.",
  "citations": [
    "a30938e4-dee9-595d-86ee-021caa69c877",
    "71c404b7-aaaf-5f14-a329-9905672aa022",
    "d5ccf27c-903c-5bf9-8ec3-646964dceea8"
  ],
  "trace_id": "1a4a10d8-715e-45c9-a61c-9770e571718f",
  "timings": {
    "retrieve_ms": 24.230832990724593,
    "generate_ms": 1691.8760409753304
  },
  "cost": {},
  "model_id": "gpt-4o-mini",
  "index_version": "mw_chunks_live",
  "retrieved": [
    {
      "chunk_id": "a30938e4-dee9-595d-86ee-021caa69c877",
      "start_ts": 137.38,
      "end_ts": 278.57,
      "score": 0.57386583,
      "text": "Don't you think they want to see, like, somebody that's presentable? And I was like, no, no. Like, this is. This is. This is the presentation. He's like, that. You have holes in your shirt. And I kind of was like, I was sure of it. I was like, yeah. I mean, that's the whole thing. I'm. I'm. I wasn't. I didn't feel like I was pulling on an act. I was like, yeah, this is what I would wear. In a way, making effort is sort of detracting from you being you. Yeah, yeah. But I do think that it's. Look, it's all part of, like, this is why I hate telling young comedians, like, how to. How to do it. Like, you know, when they go, give them advice, I'm like, I really don't like giving advice to young other than do it a lot. Like, that's the advice. But as far as, like, don't do this. I go, that's not how to do it. Like, the way to do it is to do things you think you're supposed to do, and then you figure out how to actually do whether or not you're supposed to do them. Yeah. If I tell you don't do. Make sure you don't do this. That might keep you from encountering something that actually really spark something in you. You know what I mean? Well, there's a difference between 2D lessons that you learn from someone telling you while you're reading it in a book, and 3D lessons that you learn from experiencing it firsthand. A thousand percent. Yeah. Yeah. There's a guy called Bill Perkins who lives here in Austin. He came on the show. He wrote this book called Die with Zero, which is about how to sort of make the most of your wealth. And it's written for people who struggle to spend money, even though they might earn a little bit more than they need to, and they're, you know, sort of skin thrift, and they don't spend the money so much. I'm aware that you have no idea what I'm talking. And I had read the book, and then immediately after that from the podcast, he said, oh, why don't you come and wake surf with me? And I got to learn the lesson both from the book and then from the podcast, and then I got to experience it with him firsthand. And there's a driver outside, and there's a boat, and there's a blah, blah, and it's like, ha, yeah, now I know what he's talking about. And it's the same with this. You can tell someone, hey, you maybe consider yourself a professional, be presentable, consider your health, go to bed on time, et cetera. But if you arrive at that realization yourself, it's way deeper. As opposed to being like, yeah, I mean, Tom said that, but maybe he's full of shit. I don't know. Yeah. And. And honestly, also to make it like to on the money thing of like, one thing that nobody ever wants to hear is like, money won't make you feel fulfilled. Like, no one wants to hear that.",
      "episode_id": "0a4fa77e-bc0f-11ef-bab6-3f37b4906b43"
    },
    {
      "chunk_id": "71c404b7-aaaf-5f14-a329-9905672aa022",
      "start_ts": 4496.81,
      "end_ts": 4675.46,
      "score": 0.5599251,
      "text": "And I remember we walked back from, we went to a bar that was near the hotel and we walked back to the hotel and he was like, he's overweight, but he was like, really huffing and puffing, sweating. And I was like, God, fat. I was like, I'm fat, but you're a mess. Like, I was like, that was hard for you. Like, we just walked, like on a, you know, no hill, just like straight down the street. It's like, all right. Well, it is Florida, you know, it's humid or whatever. And the next day, I think they spent the night and they were driving back. And so then, and then the day after that, I go, I was living in la, I get back to la, and another friend was like, oh, did you hear what happened? I was like, here? What happened? I didn't. What do you mean? Oh, yeah. On their way back to their house, my friend's wife was like, I don't like the way you look or you're breathing. So we're just gonna stop by the emergency room and like, kind of can, you know, convinced him to. They go to the emergency room, he gets X rayed, he's got tumors everywhere. He's got stage four lung cancer. And it's like. And so this is how I find out on this call. And then, you know, I, he goes immediately into treatment, right? And they're like, yeah, this is, you know, this is basically as bad as it can get. So his brother finds the specialist who treats this particular type of cancer in Indianapolis. He's doing, like, trips from, like Florida to Indianapolis. I go visit him in the hospital and, you know, he's, this is like, I don't know, maybe a month has gone by or something. So he's deep into his chemo, he's Bald, he's lost 80 pounds or something. And like, I'm like, everybody's face is kind of like, you know, you could just read it. Doctors, spouse, friends, everyone's like, like, it's good that you're here, you know? And you're like, yeah. And then him, he's just like, yeah, man, just doing this. And like, you know, I'll beat this thing. And then maybe, by the way, in the summer we can go to this. And I'm like, what the. And I'm like, oh, he's just like, crazy, you know? And I'm like, does. Does he understand the gravity of this? And they're like, I mean, I think so, but I always told him, I go, I think, think you're dumb enough to think you can do this. And I actually remember that, like when my uncle, my uncle was like a world renowned urologist, and when he got mesothelioma, I remember my dad being like, you know, it's, it's, he's too smart. He knows how to read these charts. Like, he just, he's like, he knows he's gonna die. He knows. He's just, he, he, there's just no.",
      "episode_id": "0a4fa77e-bc0f-11ef-bab6-3f37b4906b43"
    },
    {
      "chunk_id": "d5ccf27c-903c-5bf9-8ec3-646964dceea8",
      "start_ts": 6592.69,
      "end_ts": 6783.81,
      "score": 0.54297674,
      "text": "Fear of the conversation, all of the concern about whether should I be assertive but what they're gonna say. So I had this really lovely question on a Q and A last week that said, I know that I deserve more, but I'm really terrified to ask for. I didn't specify what the situation was. Maybe something at work, maybe something in a relationship, maybe something with family or what. Um, Like, I know that I deserve more, but I'm really scared of asking for it. It's like, what an odd but totally relatable relatable. Thing, situation to be in. It's like, I know that this is something that I'm allowed, that I can have, that I should have. And they probably know too. And I'm still. I'm in my head about all of this. The same thing goes for your pursuits, your professional life, your personal life, all of that stuff. Yeah, that's. That's an extremely universal question. Right. And I mean, my immediate thought is like, I. I can't help but think about, like, actually in entertainment, like in what. In what I do, is that you come into it feeling like that you're like, I want these things. And then you have representation, but you view representation as like mom and dad, which is not how you're supposed to do it. How so? Because you're young and you go, like, can I? I. Is it okay? Would you approve of me? Do you think I can? And then it cultivates these. This relationship. A lot of young actors and comedians have this, like, kind of twisted relationship with their first reps. Right. Which is why a lot of times, you people hit the next phase in their life and they change if they can, because they need. They need a relationship that's more. Are equal as opposed to, like this weird power balance. Yeah. That's not supposed to really be there because it's like, with the woman, you go like, but I want. But I don't feel like I should say to that person. It's like, there's certain people. You just feel like you can't say the thing too, which is fine. I think that's a normal thing. You need to then switch the person that you're talking to that you can speak like that too. And that's what happens a lot in our field. I would say, like, that people want to ask for things and they're scared to. I was like, well, then you need to change who you're asking. You know, I mean, obviously you need to get to the point where you feel like you can ask for these things, but sometimes you just don't feel like you can say certain things to certain people. What have you learned about human psychology through this recent obsession with true crime? Mine. Recent. I mean, 40 years. Vestigial. Yeah. Long time. Yeah. I mean, I just feel like crime and, you know, behaviors of criminals is a. I don't understand how somebody is not fascinated by how other human beings can act. I think there's something about. About crime in it, in and of itself, that is so accessible, that that's part of. In other words, you can go into the bank and rob it.",
      "episode_id": "0a4fa77e-bc0f-11ef-bab6-3f37b4906b43"
    },
    {
      "chunk_id": "8169220c-dd42-5c45-a908-0b602068e2bd",
      "start_ts": 6015.25,
      "end_ts": 6186.27,
      "score": 0.53660125,